{
  "aggregate": {
    "latency_ms_median": {
      "p50": 0.202,
      "p95": 5.964,
      "p99": 6.026
    },
    "requests_per_second_median": 14404.191
  },
  "configuration": {
    "downstream_concurrency": 1,
    "job_timeout_ms": 10000,
    "max_retries": 3,
    "process_delay_ms": 50,
    "queue_capacity": 8,
    "repeats": 1,
    "retry_base_ms": 10,
    "scenario_parameters": {
      "burst_rate": 200,
      "concurrency": 40,
      "cpu_ms": 100,
      "duration_seconds": 5,
      "failures_injected": 5,
      "rate_per_second": 50,
      "requests": 100,
      "stream_delay_ms": 5,
      "stream_items": 100,
      "tenant_probe_tenant": null
    },
    "tenant_outstanding_limit": 0,
    "workers": 2
  },
  "environment": {
    "container_limits": {
      "cpu_cores_rounded": null,
      "memory_gib_rounded": null
    },
    "git_commit": "aad3b68c04a6",
    "hardware": {
      "cpu_model": "AMD Ryzen 9 7900 12-Core Processor",
      "logical_cores": 24,
      "memory_gib_rounded": 62.0
    },
    "os": {
      "architecture": "x86_64",
      "distribution_id": "cachyos",
      "distribution_version": null,
      "family": "linux",
      "kernel_version": "7.2.3"
    },
    "python": "3.14.7",
    "tools": {
      "cargo": "cargo 1.98.1",
      "elixir": "Elixir 1.19.5",
      "erlang_otp": "28",
      "go": "go version go1.27.1",
      "golangci_lint": "golangci-lint has version 2.13.2",
      "mise": "2026.9.4",
      "mix": "Mix 1.19.5",
      "node": "v24.21.0",
      "oha": "oha 1.14.0",
      "perf": "perf version 7.2.3-1",
      "pnpm": "11.21.0",
      "rustc": "rustc 1.98.1"
    },
    "working_tree_clean": false
  },
  "git_commit": "aad3b68c04a6",
  "load_generator": {
    "name": "oha",
    "version": "oha 1.14.0"
  },
  "repetitions": [
    {
      "application_metrics": {
        "after_drain": null,
        "after_load": {
          "downstream_concurrency": 1,
          "downstream_in_use": 1,
          "in_flight": 2,
          "jobs_enqueued_total": 10,
          "jobs_failed_total": 0,
          "jobs_in_flight": 2,
          "jobs_processed_total": 0,
          "jobs_rejected_total": 90,
          "max_outstanding": 10,
          "processing_duration_ms_total": 0,
          "queue_capacity": 8,
          "queue_depth": 8,
          "rate_limited_total": 0,
          "retries_total": 0,
          "sync_requests_in_flight": 0,
          "tenant_outstanding_limit": 0,
          "tenant_rejected_total": 0,
          "workers": 2
        },
        "before": {
          "downstream_concurrency": 1,
          "downstream_in_use": 0,
          "in_flight": 0,
          "jobs_enqueued_total": 0,
          "jobs_failed_total": 0,
          "jobs_in_flight": 0,
          "jobs_processed_total": 0,
          "jobs_rejected_total": 0,
          "max_outstanding": 10,
          "processing_duration_ms_total": 0,
          "queue_capacity": 8,
          "queue_depth": 0,
          "rate_limited_total": 0,
          "retries_total": 0,
          "sync_requests_in_flight": 0,
          "tenant_outstanding_limit": 0,
          "tenant_rejected_total": 0,
          "workers": 2
        }
      },
      "graceful_shutdown": {
        "duration_seconds": 1.065034,
        "exit_code": 0,
        "timed_out": false
      },
      "http": {
        "bytes_per_second": 708830.23,
        "duration_seconds": 0.006942,
        "http_2xx_rate": 0.1,
        "latency_ms": {
          "p50": 0.202,
          "p95": 5.964,
          "p99": 6.026
        },
        "oha_success_rate": 1.0,
        "requests": 100,
        "requests_per_second": 14404.191,
        "status_codes": {
          "202": 10,
          "429": 90
        },
        "transport_errors": 0
      },
      "index": 1,
      "parameters": {
        "concurrency": 40,
        "duration_seconds": 5,
        "rate_per_second": 50,
        "requests": 100
      },
      "service_resources": {
        "average_cpu_cores": 0.056,
        "peak_rss_mib": 126.64,
        "sample_interval_ms": 100,
        "sampled": true
      },
      "tenant_probe": null
    }
  ],
  "run_id": "54c28b0c1da9",
  "scenario": "shutdown-drain",
  "schema_version": 1,
  "stack": "elixir",
  "started_at": "2026-09-29T16:14:01Z"
}
